<?xml version="1.0" encoding="UTF-8"?>

<definitions xmlns:xsi="http://www.w3.org/2001/XMLSchema-instance" xsi:noNamespaceSchemaLocation="config/Definitions.xsd" namespace="arse">
    <structure name="TestStructure">
        <documentation>Documentation for test structure</documentation>
        
        <primitiveElement type="signed_int_8" name="int8Member" />
        <primitiveElement type="signed_int_16" name="int16Member">
            <documentation>Doc for this 16</documentation>
        </primitiveElement>
        <primitiveElement type="signed_int_32" name="int32Member">
            <documentation>Doc for this 32</documentation>
        </primitiveElement>
        <primitiveElement type="signed_int_64" name="int64Member" />
    </structure>
    <enumeration name="Colour" baseType="signed_int_8">
        <documentation>Enumeration of traffic light colours</documentation>
        
        <member name="RED" value="0">
            <documentation>Stop colour</documentation>
        </member>
        
        <member name="AMBER" value="1" />
        
        <member name="GREEN" value="2">
            <documentation>Go colour</documentation>
        </member>
    </enumeration>
</definitions>